### ISSUE TITLE
Unable to execute contract function (write) on Android 4.x Webview

### ISSUE THREAD

**Issue by emosto** [ConsenSys/eth-lightwallet#107]
First of all, thank you for this amazing effort.
I'm developing an android app which has an embedded webview (javascript enabled).

The following behavior is valid only for Android 4.x. On Android 5.x and 6.x everything works great.

The API works well, except calling contract functions which write to the chain. Calling contract functions that are reading from the blockchain works perfectly. The error which is returned by the blockchain is "Account is locked" in case of writing functions. The same app on Android 5 and 6 returns the transaction hash.

Since I wanted to check what's the difference on data-transport level, I've sniffed the HTTP traffic with tcpdump. The results are following bellow. 

It seems the lightwallet is failing to compose the JSON payload in case of Android 4. Any hint what might be the cause of the problem? Or any viable workaround?

Thank you in advance!

Android 4.x
------------
12:37:20.356885 IP 192.168.200.108.38119 > project-quick.novalocal.8545: Flags [P.], seq 590239126:590239645, ack 4103784918, win 229, options [nop,nop,TS val 30052151 ecr 345970401], length 519
..!a#.U................
...7....POST / HTTP/1.1
Host: 192.168.100.13:8545
Connection: keep-alive
Content-Length: 137
Pragma: no-cache
Cache-Control: no-cache
Origin: file://
Content-Type: application/json
x-wap-profile: http://wap.samsungmobile.com/uaprof/GT-I9300.xml
User-Agent: Mozilla/5.0 (Linux; U; Android 4.3; en-us; GT-I9300 Build/JSS15J) AppleWebKit/534.30 (KHTML, like Gecko) Version/4.0 Mobile Safari/534.30
Accept-Encoding: gzip,deflate
Accept-Language: en-US
Accept-Charset: utf-8, iso-8859-1, utf-16, *;q=0.7
Accept: */*

12:37:33.346953 IP 192.168.200.108.38120 > project-quick.novalocal.8545: Flags [P.], seq 178127857:178128376, ack 1485959625, win 229, options [nop,nop,TS val 30054749 ecr 345973649], length 519
..!a..@.@..B...l..d
...X........&.....
...]..#.POST / HTTP/1.1
Host: 192.168.100.13:8545
Connection: keep-alive
Content-Length: 330
Pragma: no-cache
Cache-Control: no-cache
Origin: file://
Content-Type: application/json
x-wap-profile: http://wap.samsungmobile.com/uaprof/GT-I9300.xml
User-Agent: Mozilla/5.0 (Linux; U; Android 4.3; en-us; GT-I9300 Build/JSS15J) AppleWebKit/534.30 (KHTML, like Gecko) Version/4.0 Mobile Safari/534.30
Accept-Encoding: gzip,deflate
Accept-Language: en-US
Accept-Charset: utf-8, iso-8859-1, utf-16, *;q=0.7
Accept: */*

^C
2 packets captured
2 packets received by filter
0 packets dropped by kernel

Android 5.x and 6.x
--------------------
12:38:19.784264 IP 192.168.200.104.54504 > project-quick.novalocal.8545: Flags [P.], seq 201199717:201200326, ack 460347641, win 1369, options [nop,nop,TS val 31987218 ecr 345985258], length 609
..!a...e.pX....Yq......
......P.POST / HTTP/1.1
Host: 192.168.100.13:8545
Connection: keep-alive
Content-Length: 137
Pragma: no-cache
Cache-Control: no-cache
Origin: file://
User-Agent: Mozilla/5.0 (Linux; Android 6.0; HTC One_M8 Build/MRA58K; wv) AppleWebKit/537.36 (KHTML, like Gecko) Version/4.0 Chrome/51.0.2704.81 Mobile Safari/537.36
Content-Type: application/json
Accept: */*
Accept-Encoding: gzip, deflate
Accept-Language: bg-BG,en-US;q=0.8
X-Requested-With: io.smartstamp.android

{"jsonrpc":"2.0","method":"eth_getTransactionCount","params":["0x2ce95f014088d650f592b627527072dfb1e657af","pending"],"id":1470400703826}
12:38:21.197481 IP 192.168.200.104.54504 > project-quick.novalocal.8545: Flags [P.], seq 609:1439, ack 218, win 1386, options [nop,nop,TS val 31987359 ecr 345985260], length 830
..!a.....pY....j.V.....
......P.POST / HTTP/1.1
Host: 192.168.100.13:8545
Connection: keep-alive
Content-Length: 358
Pragma: no-cache
Cache-Control: no-cache
Origin: file://
User-Agent: Mozilla/5.0 (Linux; Android 6.0; HTC One_M8 Build/MRA58K; wv) AppleWebKit/537.36 (KHTML, like Gecko) Version/4.0 Chrome/51.0.2704.81 Mobile Safari/537.36
Content-Type: application/json
Accept: */*
Accept-Encoding: gzip, deflate
Accept-Language: bg-BG,en-US;q=0.8
X-Requested-With: io.smartstamp.android

{"jsonrpc":"2.0","method":"eth_sendRawTransaction","params":["0xf88c83100004850ba43b7400832fefd8946d166f55a4955aa183ce19f11b40fdc208e7c6d680a420baf3d6b2d323f323c21885dbce7ddb1cea62a39b7c1831329282a7c7ceb330abe17b771ca0994b122fdef24274ff89127c8cc98612fe5d3131924868d119bb31752988d5b3a018fc9723849c4a3f0285418a7e7a7e04a09994294c6c20630d7b6fa8b9b15ee3"],"id":1}
^C
2 packets captured
2 packets received by filter
0 packets dropped by kernel

**Comment by emosto** [comment]
OK. Found the issue. It turns out the Android 4.x version of Webview and JS interpreter support ES 5. The lightwallet uses Object.assign() and Symbol, which play with ES6 on Android 5 and 6.

A workaround for Android 4 is to provide Object.assign implementation for ES5:
https://developer.mozilla.org/en-US/docs/Web/JavaScript/Reference/Global_Objects/Object/assign#Polyfill

And replace Symbol iteration as described here:
https://github.com/ConsenSys/hooked-web3-provider/issues/8

I hope this is helpful for other hitting the same issue.
